{
  "imobiliaria_cnpj": "12345678000190",
  "imobiliaria_nome": "QuintoAndar Servicos Imobiliarios",
  "ano_referencia": 2024,
  "locador_cpf_present": true,
  "membro_key": null,
  "imoveis": [
    {
      "endereco": "Rua das Figueiras, 120 - Campo Belo, Sao Paulo - SP",
      "iptu_municipal": "045.678.0123-1",
      "locatario_cnpj": null,
      "aluguel_bruto_anual": "36000.00",
      "taxa_administracao_anual": "2880.00",
      "ir_retido_anual": "0",
      "iptu_anual_pago": null,
      "condominio_anual_pago": null,
      "aluguel_liquido_anual": "33120.00",
      "meses_locado_no_periodo": 12,
      "mes_inicial": null,
      "indice_reajuste": "IGPM",
      "data_ultimo_reajuste": "2024-05",
      "notas": null
    }
  ],
  "confidence": 1.0,
  "notes": null
}
